{
  "$schema": "https://json-schema.org/draft/2020-12/schema",
  "$id": "https://aiflow.local/schemas/review-context.schema.json",
  "title": "AI Flow structured review context",
  "type": "object",
  "additionalProperties": false,
  "required": ["schema_version", "review_stage", "task_id", "decision_unit_ids", "repository_id", "branch", "base_commit", "spec_sha256", "policy_sha256", "classification_input_sha256", "context_sha256", "content"],
  "properties": {
    "schema_version": {"const": "1.0"},
    "review_stage": {"enum": ["design", "implementation"]},
    "task_id": {"type": "string", "pattern": "^TASK-[0-9]{4,}$"},
    "decision_unit_ids": {"type": "array", "minItems": 1, "uniqueItems": true, "items": {"type": "string", "pattern": "^DU-[0-9]{3,}$"}},
    "repository_id": {"type": "string", "format": "uuid"},
    "branch": {"type": "string", "minLength": 1},
    "base_commit": {"type": "string", "pattern": "^[0-9a-f]{40}$"},
    "spec_sha256": {"type": "string", "pattern": "^[0-9a-f]{64}$"},
    "policy_sha256": {"type": "string", "pattern": "^[0-9a-f]{64}$"},
    "classification_input_sha256": {"type": "string", "pattern": "^[0-9a-f]{64}$"},
    "context_sha256": {"type": "string", "pattern": "^[0-9a-f]{64}$"},
    "subject_commit": {"type": "string", "pattern": "^[0-9a-f]{40}$"},
    "evidence_sha256": {"type": "string", "pattern": "^[0-9a-f]{64}$"},
    "content": {"type": "object"}
  },
  "allOf": [
    {"if": {"properties": {"review_stage": {"const": "design"}}, "required": ["review_stage"]}, "then": {"not": {"anyOf": [{"required": ["subject_commit"]}, {"required": ["evidence_sha256"]}]}}},
    {"if": {"properties": {"review_stage": {"const": "implementation"}}, "required": ["review_stage"]}, "then": {"required": ["subject_commit", "evidence_sha256"]}}
  ]
}
