{
  "base_commit": "e8e59e2b4112249c4c85c9a0eb1d510bacd9e597",
  "branch": "codex/e4-external-review-contract",
  "classification_input_sha256": "475007ba455cef17d66088107d5ce0a0f1494ce6b4066fce3798e5015509e4c7",
  "content": {
    "allowed_scope": [
      ".ai/schemas/external-review.schema.json",
      "src/aiflow/contracts.py",
      "tests/unit/test_contracts.py",
      "tests/fixtures/contracts/valid/external-review.json",
      "tests/fixtures/contracts/invalid/external-review.*.json"
    ],
    "decision_units": [
      {
        "decision_unit_id": "DU-001",
        "goal": "Add a bounded external ZCode review envelope contract and compatibility checks for E4.1",
        "impact_scope": [
          ".ai/schemas/external-review.schema.json",
          "src/aiflow/contracts.py",
          "tests/unit/test_contracts.py",
          "tests/fixtures/contracts/valid/external-review.json",
          "tests/fixtures/contracts/invalid/external-review.*.json"
        ],
        "planned_actions": [
          "Add a closed external-review 1.0 schema for a source report envelope with separate target and source subjects.",
          "Register the new contract name and suppress unknown-property-name echo only for the external-review contract, preserving existing contract diagnostics.",
          "Add synthetic valid and invalid fixtures and bounded contract regression tests as task-free safety checks."
        ]
      }
    ],
    "goal": "Add a bounded external ZCode review envelope contract and compatibility checks for E4.1",
    "route": "REVIEW",
    "verification_level": "V1"
  },
  "context_sha256": "1684ba5a80dc8e0f61c4170471c96c8120e54a61aa58f81dc4d6d9b2c4d0736a",
  "decision_unit_ids": [
    "DU-001"
  ],
  "policy_sha256": "d21a386779147dfad962a0fc0656bef61bc581e27f63c4789dcc06520fa10ff1",
  "repository_id": "b85e5a53-4935-4436-bdbc-c26a241bfae8",
  "review_stage": "design",
  "schema_version": "1.0",
  "spec_sha256": "d7f58a9987923dde66c9cd601a442e9ab8f6fe6f96222408245be04898253a10",
  "task_id": "TASK-0054"
}
