{
  "base_commit": "3f3ead9eeb3cc1039be58627994a3a0d58102534",
  "branch": "main",
  "classification_input_sha256": "28204d9e485e11ca0948982038798e99f8148512a491550e80f4ebeb1e14a75a",
  "content": {
    "allowed_scope": [
      "src/aiflow/verification_service.py",
      "src/aiflow/gate.py",
      "tests/integration/test_verify_command.py",
      "tests/integration/test_gate_command.py",
      "docs/implementation/chapter-13-review-self-hosting.md",
      "docs/superpowers/state/chapters/chapter-13.yaml",
      "docs/superpowers/state/overall.yaml"
    ],
    "decision_units": [
      {
        "decision_unit_id": "DU-001",
        "goal": "Complete Chapter 13.3 by adding a read-only V2 CI replay of current local-final mutation evidence, splitting local-final review facts from external CI execution facts in Gate, proving the closure in one isolated simulation, and projecting only 13.3 complete.",
        "impact_scope": [
          "src/aiflow/verification_service.py",
          "src/aiflow/gate.py",
          "tests/integration/test_verify_command.py",
          "tests/integration/test_gate_command.py",
          "docs/implementation/chapter-13-review-self-hosting.md",
          "docs/superpowers/state/chapters/chapter-13.yaml",
          "docs/superpowers/state/overall.yaml"
        ],
        "planned_actions": [
          "Load and validate the current task-local final V2 evidence before V2 CI execution, derive the existing independent verifier binding, and replay its immutable mutation artifact",
          "Keep V2 CI checks read-only with respect to the task directory and prohibit recorder, action-consumption and mutation-runner calls",
          "Evaluate V2 Gate with current local-final review/code-approval facts and independently current external CI checks, mutation replay, verifier/context and attestation facts",
          "Add positive and fail-closed integration coverage while preserving V0/V1 and local V2 behavior",
          "Validate the corrected implementation first with a separately approved full local V2 transaction",
          "After a separate single-use action approval, create one exact OS-temporary local Git worktree at the corrected TASK-0028 H1 code-approval attestation commit",
          "Run CI-mode verification into an exact OS-temporary run directory and evaluate the read-only Gate against that CI evidence; CI must not launch targeted mutation",
          "Record a sanitized task-local CI simulation receipt and update the Chapter 13 implementation narrative, then project only task 13.3 complete and advance to pending 13.4",
          "Reverify the completion projection under a new current-subject V2 action, independent implementation review, code approval and local Gate"
        ]
      }
    ],
    "goal": "Complete Chapter 13.3 by implementing fail-closed V2 CI attestation over current local-final evidence, proving it with an isolated CI simulation and Gate, and projecting only 13.3 complete.",
    "route": "REVIEW",
    "verification_level": "V2"
  },
  "context_sha256": "0d3efee5c9ef2b73936729c5e6fecd88cc2e10756b7ff33823d83acff91e0e71",
  "decision_unit_ids": [
    "DU-001"
  ],
  "policy_sha256": "f4854d7fa05e5bddc21303350476bf47568bfe50f64c9d1f9199c0d744321bbf",
  "repository_id": "b85e5a53-4935-4436-bdbc-c26a241bfae8",
  "review_stage": "design",
  "schema_version": "1.0",
  "spec_sha256": "657bac588589c0fabb9c8d6a108ab9077cd101c9648f55d0d3f5e71299f06877",
  "task_id": "TASK-0028"
}
