{
  "base_commit": "ef92b795da729566870ff4878f100a4ffe319db5",
  "branch": "codex/e4-verification-control",
  "classification_input_sha256": "a4c4da234481675e43defb342480d5010c15d897a65c7aec2cff0d2d7013b33b",
  "content": {
    "allowed_scope": [
      "src/aiflow/verification_temporary.py",
      "src/aiflow/verification.py",
      "src/aiflow/verification_service.py",
      "src/aiflow/process_runner.py",
      "src/aiflow/cli.py",
      "tests/unit/test_verification_temporary.py",
      "tests/unit/test_verification_plan.py",
      "tests/unit/test_process_runner.py",
      "tests/integration/test_verify_command.py",
      "docs/operations/pytest-temporary-roots.md",
      "tests/integration/test_external_review_command.py",
      "tests/integration/test_begin_close_commands.py",
      "src/aiflow/document_parsing.py",
      "src/aiflow/policy.py",
      "src/aiflow/storage.py",
      "tests/unit/test_document_parsing.py",
      "tests/unit/test_policy.py",
      "tests/unit/test_storage.py",
      "tests/integration/repository_fixture.py",
      "tests/integration/conftest.py",
      "tests/integration/test_repository_fixture.py",
      "src/aiflow/external_review.py",
      "tests/unit/test_external_review_metadata.py",
      "docs/operations/external-review-import.md"
    ],
    "decision_units": [
      {
        "decision_unit_id": "DU-001",
        "goal": "Add explicit run-owned external pytest temporary roots for governed verification",
        "impact_scope": [
          "src/aiflow/verification_temporary.py",
          "src/aiflow/verification.py",
          "src/aiflow/verification_service.py",
          "src/aiflow/process_runner.py",
          "src/aiflow/cli.py",
          "tests/unit/test_verification_temporary.py",
          "tests/unit/test_verification_plan.py",
          "tests/unit/test_process_runner.py",
          "tests/integration/test_verify_command.py",
          "docs/operations/pytest-temporary-roots.md",
          "tests/integration/test_external_review_command.py",
          "tests/integration/test_begin_close_commands.py",
          "src/aiflow/document_parsing.py",
          "src/aiflow/policy.py",
          "src/aiflow/storage.py",
          "tests/unit/test_document_parsing.py",
          "tests/unit/test_policy.py",
          "tests/unit/test_storage.py",
          "tests/integration/repository_fixture.py",
          "tests/integration/conftest.py",
          "tests/integration/test_repository_fixture.py",
          "src/aiflow/external_review.py",
          "tests/unit/test_external_review_metadata.py",
          "docs/operations/external-review-import.md"
        ],
        "planned_actions": [
          "Add an explicit optional external pytest temporary root with independent ordinary-path and run-ownership guards.",
          "Append fixed owned basetemp arguments after unchanged Policy validation and preserve execution evidence and finalization context.",
          "Retain existing environment, selectors, budgets, thresholds and default behavior.",
          "Repair only test-side Windows physical I/O and owned Git process-tree timeout cleanup while retaining logical fixture roots, original assertions, command deadlines and production environment.",
          "Reuse only bounded content-keyed pure YAML decoding with independent return values, fresh actual file reads and all unchanged schema, semantic, identity and freshness validation.",
          "Reuse only a session-private pristine initial test repository after the original real builder succeeds at its original target; physically copy independent Git files after current complete input eligibility, preserving cold fallback, partial failure behavior, all original assertions and subsequent real governance.",
          "Change only external_review metadata identity Windows creation-time selection to available st_birthtime_ns, including zero, with legacy attribute-absence st_ctime_ns fallback; retain POSIX ctime and every current identity, double-read, raw-byte and path guard. Supporting tests and documentation are a separate task-free safety maintenance unit, retained in cumulative validation scope.",
          "Qualify only the complete existing Windows mingw64/bin Git endpoint in the session-private test fixture, live-binding both core/wrapper and preserving every source/config/template/attributes/owner/cold/error guard. Safety fixture/test changes are a separate task-free unit. Runtime computed PATH changes honestly; production environment algorithm and Git context/transport are untouched."
        ]
      }
    ],
    "goal": "Add explicit run-owned external pytest temporary roots for governed verification",
    "route": "REVIEW",
    "verification_level": "V2"
  },
  "context_sha256": "56d71328dcf0e153c00dbc70b6128b893ad52806ba58484917850e1abf715458",
  "decision_unit_ids": [
    "DU-001"
  ],
  "policy_sha256": "d21a386779147dfad962a0fc0656bef61bc581e27f63c4789dcc06520fa10ff1",
  "repository_id": "b85e5a53-4935-4436-bdbc-c26a241bfae8",
  "review_stage": "design",
  "schema_version": "1.0",
  "spec_sha256": "b589852985fea26583efe09009aefe710465625ffac14609213c5d1caf3c1d70",
  "task_id": "TASK-0056"
}
